,book_name,book_writer,translator,book_date,book_page,ori_book_price,sale_book_price,mileage
0,포르잔 C++ 에센셜," Behrouz A. Forouzan , Richard F. Gilberg ", 윤인성 , 2020-11-10, 756 ,32000,32000,960
1,"IT CookBook, 액세스 2019로 배우는 데이터베이스 기초와 실습", 김지연 , , 2020-09-28, 536 ,28000,28000,840
2,포르잔 C++ 바이블," Behrouz A. Forouzan , Richard F. Gilberg ", 윤인성 , 2020-08-31, 1192 ,45000,45000,1350
3,딥러닝을 위한 선형대수학, Gilbert Strang , 부산대학교 산업수학센터(FFMIMC) , 2020-08-05, 560 ,38000,38000,1140
4,"IT CookBook, 오라클로 배우는 데이터베이스 개론과 실습(2판)"," 박우창 , 남송휘 , 이현룡 ", , 2020-07-30, 600 ,29000,29000,870
5,대학을 버려야 대학이 산다, 조동성 외 인천대학교 가족 178명 , , 2020-07-25, 216 ,18000,18000,540
6,"IT CookBook, 따라 하면서 배우는 사물인터넷", 양재삼 , , 2020-07-23, 448 ,28000,28000,840
7,R로 하는 다변량 데이터 분석 : 이론부터 실무 활용까지," 카와하시 잇코 , 이와마 노리카즈 , 스즈키 마사유키 ", 권기태 , 2020-07-10, 544 ,32000,32000,960
8,창의적 공학설계(3판), 김은경 , , 2020-07-10, 408 ,23000,23000,690
9,공학 핵심수학(2판)  : 기초부터 심화까지 핵심만 쏙쏙, 함남우 , , 2020-07-06, 484 ,23000,23000,690
10,응용이 보이는 선형대수학 : 파이썬과 함께하는 선형대수학 이론과 응용, 이건명 , , 2020-07-06, 592 ,31000,31000,930
11,"IT CookBook, 초연결 사회의 데이터통신과 네트워킹", 강문식 , , 2020-06-30, 504 ,29000,29000,870
12,"IT CookBook, 쉽게 배우는 MFC 윈도우 프로그래밍"," 김선우 , 신화선 ", , 2020-06-20, 772 ,30000,30000,900
13,"IT CookBook, 인공지능 시대를 위한 컴퓨터 과학 개론", 정기철 , , 2020-06-19, 520 ,27000,27000,810
14,"IT CookBook, 코틀린을 활용한 안드로이드 프로그래밍"," 우재남 , 유혜림 ", , 2020-06-19, 564 ,34000,34000,1020
15,"IT CookBook, 처음 만나는 신재생에너지", 김지홍 , , 2020-06-10, 388 ,25000,25000,750
16,프리드버그 선형대수학," 스티븐 H. 프리드버그 , 아놀드 J. 인셀 , 로렌스 E. 스펜스 "," 한빛수학교재연구소 , 심형보(감수) ", 2020-06-05, 616 ,35000,35000,1050
17,"IT CookBook, CentOS 리눅스", 이종원 , , 2020-05-30, 792 ,32000,32000,960
18,"Microeconomics, 6th Edition, Asia Edition"," David Besanko , Ronald Braeutigam ", , 2020-05-01, 856 ,49000,49000,1470
19,누구나 파이썬 통계분석, 타니아이 히로키 , 권기태 , 2020-04-06, 384 ,26000,26000,780
20,제대로 배우는 MATLAB&Simulink, 방성완 , , 2020-03-05, 576 ,29000,29000,870
21,공학도를 위한 경영 : 4차 산업혁명 시대, 하귀룡 , , 2020-02-28, 348 ,25000,25000,750
22,"SWedu 011, 앱 인벤터(2판) : 쉽고 재미있게 만드는 앱 프로그래밍", 이종원 , , 2020-02-21, 408 ,24000,24000,720
23,"IT CookBook, 컴파일러의 이해 : 내공 있는 프로그래머로 길러주는 (증보판)", 박두순 , , 2020-02-20, 508 ,27000,27000,810
24,(2020) 완벽분석! 사회조사분석사 2급 실기," 노경섭 , 김성일 , 김기만 ", , 2020-01-30, 384 ,28000,28000,840
25,"IT CookBook, 운영체제론 : Operating Systems, 3rd Ed"," 하비 디텔 , 폴 디텔 , 데이빗 쇼픈스 ", 송경희 , 2020-01-30, 860 ,32000,32000,960
26,기초수학 : Basic Mathematics(2판), 이재원 , , 2020-01-10, 312 ,20000,20000,600
27,"IT CookBook, Android Studio를 활용한 안드로이드 프로그래밍(5판)"," 우재남 , 박길식 ", , 2020-01-08, 572 ,29000,29000,870
28,"IT CookBook, 4차 산업혁명 시대의 정보통신개론", 고응남 , , 2020-01-06, 600 ,25000,25000,750
29,"IT CookBook, C 언어 일취월장", 신윤환 , , 2020-01-06, 808 ,28000,28000,840
30,"IT CookBook, UI 디자인과 프로토타이핑을 위한 Adobe XD", 이영주 , , 2020-01-06, 552 ,27000,27000,810
31,"IT CookBook, UI/UX 디자인 이론과 실습 with Adobe XD", 이영주 , , 2020-01-06, 560 ,28000,28000,840
32,"IT CookBook, 객체 지향 설계와 분석을 위한 UML 기초와 응용"," 한정수 , 김귀정 ", , 2020-01-06, 336 ,24000,24000,720
33,"IT CookBook, 리눅스 실습 for Beginner", 우재남 , , 2020-01-06, 488 ,24000,24000,720
34,"IT CookBook, 비주얼 베이직 2019 입문", 임관철 , , 2020-01-06, 436 ,25000,25000,750
35,"IT CookBook, 스크래치로 배우는 컴퓨팅 사고"," 조성호 , 고광일 ", , 2020-01-06, 384 ,21000,21000,630
36,"IT CookBook, 엑셀로 배우는 데이터 분석", 박주미 , , 2020-01-06, 480 ,21000,21000,630
37,"IT CookBook, 초연결 사회를 위한 컴퓨터 개론", 조성호 , , 2020-01-06, 538 ,26000,26000,780
38,"IT CookBook, 파이썬 for Beginner(2판)", 우재남 , , 2020-01-06, 504 ,23000,23000,690
39,NO BULLSHIT 선형대수학 가이드, Ivan Savov ," 김대정 , 모현선 , 배준우 ", 2020-01-06, 628 ,28000,28000,840
40,NO BULLSHIT 수학&물리 가이드, Ivan Savov , 권기영 , 2020-01-06, 568 ,28000,28000,840
41,정보교과교육론(2판)," 이태욱 , 최현종 , 전용주 ", , 2020-01-06, 464 ,27000,27000,810
42,실무로 완성하는 PLC(멜섹Q) : 서보를 이용한 위치 제어, 정완보 , , 2020-01-02, 568 ,28000,28000,840
43,"College Physics, 5th Edition", Alan Giambattista , , 2020-01-01, 1232 ,45000,45000,1350
44,Stata로 끝내는 논문, 정규형 , , 2019-12-09, 372 ,25000,25000,750
45,"Business Statistics: For Contemporary Decision Making, 10th Edition, Asia Edition", Ken Black , , 2019-12-01, 832 ,49000,49000,1470
46,(2020) 완벽분석! 사회조사분석사 2급 필기," 노경섭 , 김성일 , 김기만 ", , 2019-11-20, 588 ,30000,30000,900
47,"IT CookBook, 유닉스 이론과 실습(3판)"," 이종원 , 윤소정 ", , 2019-11-13, 568 ,25000,25000,750
48,"IT CookBook, 경영경제통계학", 유영태 , , 2019-10-18, 472 ,28000,28000,840
49,"Swedu, 정보적 사고에서 인공 지능까지", 김현철 , , 2019-09-28, 184 ,19000,19000,570
50,"IT CookBook, 문제 해결력을 키우는 디자인 씽킹"," 송태란 , 이정현 ", , 2019-09-10, 300 ,22000,22000,660
51,"IT CookBook, 모두를 위한 R 데이터 분석 입문", 오세종 , , 2019-08-24, 480 ,26000,26000,780
52,"IT CookBook, 최신 컴퓨터 구조"," 임석구 , 홍경호 ", , 2019-08-17, 616 ,28000,28000,840
53,"IT CookBook , MySQL로 배우는 데이터베이스 개론과 실습"," 박우창 , 남송휘 , 이현룡 ", , 2019-08-15, 572 ,27000,27000,810
54,"IT CookBook, HTML5 웹 프로그래밍 입문(3판)", 윤인성 , , 2019-07-20, 488 ,26000,26000,780
55,"IT CookBook, 컴퓨터 활용과 실습 2016", 김주영 , , 2019-07-15, 520 ,24000,24000,720
56,"IT Cookbook, 처음 만나는 전자회로", 황형수 , , 2019-07-10, 440 ,24000,24000,720
57,스트랭 미분방정식과 선형대수학, Gilbert Strang , 한빛수학교재연구소 , 2019-07-09, 552 ,30000,30000,900
58,"IT CookBook, 네트워크 개론(3판)", 진혜진 , , 2019-07-05, 516 ,25000,25000,750
59,"IT CookBook, 텐서플로로 배우는 딥러닝"," 박혜정 , 석경하 , 심주용 , 황창하 ", , 2019-06-30, 448 ,27000,27000,810
60,"IT CookBook, 파워포인트 2016", 김지연 , , 2019-06-29, 420 ,19000,19000,570
61,"SWedu, 스크래치 3.0 : 컴퓨팅 사고력을 키우는 블록 코딩", 고광일 , , 2019-06-10, 392 ,22000,22000,660
62,"IT CookBook, design school 포토샵 & 일러스트레이터 CC 2019", 이영주 , , 2019-06-06, 616 ,23000,23000,690
63,"IT CookBook, PHP 프로그래밍 입문(3판)", 황재호 , , 2019-05-20, 456 ,25000,25000,750
64,칼만 필터는 어렵지 않아 with MATLAB Examples, 김성필 , , 2019-05-20, 256 ,26000,26000,780
65,"IT CookBook, R로 배우는 데이터 과학"," 양윤석 , 오일석 , 강래형 ", , 2019-05-08, 440 ,27000,27000,810
66,"IT CookBook, design school 포토샵 CC 2019", 이영주 , , 2019-04-19, 540 ,22000,22000,660
67,제대로 알고 쓰는 논문 통계분석 : SPSS & AMOS (개정증보판), 노경섭 , , 2019-02-28, 460 ,28000,28000,840
68,이산수학 : tool 중심으로 이해하는 새로운 시각, 박두순 , , 2019-01-31, 484 ,24000,24000,720
69,"IT CookBook, 따라 하면서 배우는 마이크로컨트롤러", 허경용 , , 2019-01-28, 528 ,28000,28000,840
70,"IT CookBook, 데이터베이스 개론(2판)", 김연희 , , 2019-01-03, 592 ,27000,27000,810
71,스트랭 미분적분학, Gilbert Strang , 한빛수학교재연구소 , 2019-01-02, 872 ,34000,34000,1020
72,"IT CookBook, 데이터 과학을 위한 파이썬 프로그래밍", 최성철 , , 2019-01-01, 536 ,25000,25000,750
73,"IT CookBook, 데이터베이스 for Beginner", 우재남 , , 2019-01-01, 520 ,24000,24000,720
74,한번에 통과하는 논문 : AMOS 구조방정식 활용과 SPSS 고급 분석, 히든그레이스 논문통계팀 , , 2018-12-24, 536 ,28000,28000,840
75,공학도라면 반드시 알아야 할 최소한의 과학, John Bird , 권기영 , 2018-12-21, 456 ,24000,24000,720
76,"IT CookBook, 전공자를 위한 C 언어 프로그래밍", 주우석 , , 2018-12-14, 668 ,29000,29000,870
77,"IT CookBook, design school 프리미어 프로 CC", 강재신 , , 2018-12-07, 532 ,25000,25000,750
78,"IT CookBook, design school 일러스트레이터 CC", 이영주 , , 2018-11-30, 428 ,23000,23000,690
79,"IT CookBook, 모바일 & 데스크톱을 위한 웹 기획 프로세스", 강은정 , , 2018-11-25, 424 ,24000,24000,720
80,"IT CookBook, 시스템 해킹과 보안(3판)", 양대일 , , 2018-11-12, 568 ,27000,27000,810
81,"IT CookBook, 자바 프로그래밍 for Beginner", 우재남 , , 2018-11-10, 600 ,26000,26000,780
82,"IT CookBook, 쉽게 배우는 JSP 웹 프로그래밍", 송미영 , , 2018-10-08, 636 ,27000,27000,810
83,NCS를 기반으로 한 직무 기초수학," 이광연 , 조성훈 , 최상일 ", , 2018-10-05, 408 ,22000,22000,660
84,수치해석학 바이블," Ward Cheney , David Kincaid "," 이병준 , 한희재 ", 2018-09-28, 676 ,32000,32000,960
85,MATLAB으로 배우는 공학 수치해석(개정판), 방성완 , , 2018-07-20, 352 ,24000,24000,720
86,"IT CookBook, 모바일 UI/UX 디자인 실무", 이영주 , , 2018-07-09, 528 ,28000,28000,840
87,"IT CookBook, C 언어 for Beginner(개정3판)", 우재남 , , 2018-06-30, 516 ,23000,23000,690
88,"IT CookBook, R로 배우는 딥러닝"," 박혜정 , 석경하 , 심주용 , 황창하 ", , 2018-06-30, 240 ,23000,23000,690
89,"IT CookBook, 쉽게 배우는 운영체제", 조성호 , , 2018-06-30, 616 ,28000,28000,840
90,"SWedu, 엔트리파이선"," 정영식 , 홍은미 , 김슬기 , 김성훈 ", , 2018-06-30, 264 ,22000,22000,660
91,"IT CookBook, 엑셀 2016", 김지연 , , 2018-06-29, 412 ,19000,19000,570
92,만만한 통계 : Excel 활용, 닐 샐카인드(Neil J. Salkind) , 김재경 , 2018-06-29, 476 ,26000,26000,780
93,문과생도 이해하는 확률과 통계, 야마모토 토시로 , 박윤경 , 2018-06-29, 300 ,20000,20000,600
94,수식이 보이는 공학수학 : Engineering Mathematics (개정판), 장윤석 , , 2018-06-20, 476 ,24000,24000,720
95,"IT CookBook, 핵심이 보이는 전자회로 with PSPICE(개정판)", 신경욱 , , 2018-04-30, 660 ,32000,32000,960
96,MOS 2016 액세스," 김경희 , 오해강 ", , 2018-04-17, 292 ,14000,14000,420
97,MATLAB으로 배우는 공학수학 : Engineering Mathematics (개정판), 소상균 , , 2018-04-05, 744 ,28000,28000,840
98,한번에 통과하는 논문 : SPSS 결과표 작성과 해석 방법, 히든그레이스 논문통계팀 , , 2018-03-28, 420 ,23000,23000,690
99,"IT CookBook, C++ 트레이닝", 김상형 , , 2018-03-25, 484 ,26000,26000,780
100,4차 산업혁명 시대의 기업 혁신을 위한 비즈니스 프로세스," 정승렬 , 이정규 ", , 2018-03-10, 484 ,29000,29000,870
101,"IT CookBook, 핵심이 보이는 제어공학(개정판)", 김성중 , , 2018-02-28, 564 ,26000,26000,780
102,"IT CookBook, 우분투 리눅스(개정판)", 이종원 , , 2018-02-20, 856 ,31000,31000,930
103,쉽고 빠르게 합격하는 COS 2급, 이연란 , , 2018-02-12, 324 ,18000,16200,900
104,생각하며 배우는 대학물리학, 이기영 , , 2018-02-02, 632 ,30000,30000,900
105,"IT CookBook, 소프트웨어 세상을 여는 컴퓨터 과학", 김종훈 , , 2018-01-26, 376 ,22000,22000,660
106,"IT CookBook, 쉽게 배우는 알고리즘(개정판)", 문병로 , , 2018-01-20, 528 ,27000,27000,810
107,MOS 2016 아웃룩," 김경희 , 오해강 ", , 2018-01-19, 248 ,14000,14000,420
108,"IT CookBook, 확률과 랜덤 과정", 정호영 , , 2018-01-15, 340 ,23000,23000,690
109,"IT CookBook, 기초부터 시작하는 PLC: 지멘스 S7-1500", 정완보 , , 2018-01-10, 492 ,23000,23000,690
110,"IT CookBook, 정보 보안 개론 개정3판", 양대일 , , 2018-01-10, 584 ,28000,28000,840
111,미분적분학 에센스, 제임스 스튜어트 , 한빛수학교재연구소 , 2018-01-08, 516 ,28000,28000,840
112,미분적분학 바이블, 제임스 스튜어트 , 한빛수학교재연구소 , 2018-01-04, 948 ,34000,34000,1020
113,"IT CookBook, 기초 회로이론(개정 2판)", 최윤식 , , 2017-12-28, 484 ,24000,24000,720
114,"IT CookBook , 엑셀과 파워포인트 2016", 김지연 , , 2017-12-27, 512 ,22000,22000,660
115,"IT CookBook, 기본 개념과 핵심 원리로 배우는 C++ 프로그래밍", 김화수 , , 2017-12-22, 624 ,28000,28000,840
116,"SWedu, 파이선으로 쉽게 배우는 프로그래밍 입문", 조인석 , , 2017-12-21, 376 ,21000,21000,630
117,"IT CookBook, 단계별로 배우는 안드로이드 프로그래밍", 김선우 , , 2017-12-08, 740 ,35000,35000,1050
118,기계 학습, 오일석 , , 2017-12-05, 664 ,32000,32000,960
119,"IT CookBook, C 언어 트레이닝", 김상형 , , 2017-12-04, 524 ,25000,25000,750
120,code.org를 활용한 컴퓨팅 사고력과 코딩 교육," 제인 크라우스 , 키키 프롯츠만 "," 김수환 , 김찬웅 , 김해영 ", 2017-11-30, 232 ,19000,19000,570
121,"IT CookBook, 디지털 영상처리"," 심동규 , 임웅 ", , 2017-11-30, 512 ,28000,28000,840
122,"IT CookBook, 전기전자공학 개론(개정 6판)"," Stan Gibilisco , Simon Monk "," 권기영 , 조성재 , 유태훈 ", 2017-11-30, 828 ,32000,32000,960
123,"IT CookBook, 핵심이 보이는 전자회로 실험 with PSPICE", 신경욱 , , 2017-11-30, 464 ,25000,25000,750
124,"IT CookBook, 페도라 리눅스(개정판)", 이종원 , , 2017-11-10, 856 ,29000,29000,870
125,한번에 통과하는 논문 : 논문 검색과 쓰기 전략, 히든그레이스 논문통계팀 , , 2017-11-05, 332 ,18900,18900,567
126,"SWedu, 비트브릭"," 김경하 , 박승미 , 최선경 , 이민아 , 김진선 , 강병수 , 이신영 ", , 2017-10-22, 344 ,19000,19000,570
127,MOS 2016 워드 Expert," 김경희 , 오해강 ", , 2017-10-20, 256 ,14000,14000,420
128,공학도라면 반드시 알아야 할 최소한의 수학, John Bird , 이재원 , 2017-09-30, 396 ,22000,22000,660
129,MOS 2016 엑셀 Expert," 김경희 , 오해강 ", , 2017-09-11, 312 ,14000,14000,420
130,MOS 2016 파워포인트," 김경희 , 오해강 ", , 2017-09-11, 248 ,14000,14000,420
131,4차 산업혁명 시대의 경영정보시스템, 이동훈 , , 2017-08-08, 476 ,28000,28000,840
132,"IT CookBook, 쉽게 배우는 자바 프로그래밍", 우종정 , , 2017-08-02, 692 ,27000,27000,810
133,"IT CookBook, 차세대 웹 프로그래밍", 홍성용 , , 2017-07-30, 468 ,26000,26000,780
134,개념이 잡히는 디지털 전자회로, 강영국 , , 2017-07-27, 716 ,29000,29000,870
135,"IT CookBook, 유닉스 시스템 프로그래밍", 이종원 , , 2017-07-17, 520 ,25000,25000,750
136,문과생도 이해하는 전기전자수학, 야마시타 아키라 ," 박윤경 , 이현숙 ", 2017-07-14, 352 ,20000,20000,600
137,확률과 통계 입문 : Basic Probability & Statistics, 이재원 , , 2017-07-10, 352 ,20000,20000,600
138,기초 미분적분학(개정판) : Pre Calculus, 함남우 , , 2017-07-07, 392 ,22000,22000,660
139,"IT CookBook, 인터넷 해킹과 보안 개정3판", 김경곤 , , 2017-06-30, 488 ,25000,25000,750
140,"IT CookBook, MFC 윈도우 프로그래밍", 강경우 , , 2017-06-26, 512 ,27000,27000,810
141,"IT CookBook, 웹 디자인 이론과 실습", 강은정 , , 2017-06-05, 400 ,25000,25000,750
142,"IT CookBook, 기초부터 시작하는 PLC : 멜섹Q", 정완보 , , 2017-04-28, 484 ,23000,23000,690
143,"IT CookBook, C로 시작하는 컴퓨터 프로그래밍 개정3판"," 문호석 , 손명호 ", , 2017-04-17, 424 ,20000,20000,600
144,객체지향 소프트웨어 공학, 최은만 , , 2017-04-10, 608 ,29000,29000,870
145,기초 공업수학, 마인숙 , , 2017-02-28, 392 ,20000,20000,600
146,"IT CookBook, 반도체 공학(개정판)", 김동명 , , 2017-02-17, 908 ,35000,35000,1050
147,"IT CookBook, 기초 통신이론", 김영길 , , 2017-02-06, 356 ,22000,22000,660
148,데이터 아이코놀로지, 박진완 , , 2017-01-26, 320 ,26000,26000,780
149,"IT CookBook, 임베디드 리눅스 기초와 응용"," 우종정 , 사공준 ", , 2017-01-24, 488 ,22000,22000,660
150,"IT CookBook, 컴퓨팅 사고력을 키우는 이산수학(개정판)", 박주미 , , 2017-01-14, 592 ,25000,25000,750
151,easy LED : 초보자를 위한 LED 가이드북, 홍순관 , , 2017-01-02, 204 ,18000,18000,540
152,"IT CookBook, 디지털 시스템 설계 및 실습 with VHDL & Verilog HDL", 노승환 , , 2017-01-02, 440 ,25000,25000,750
153,"IT CookBook, 기초 전기전자 에센스"," 모현선 , 장성용 , 홍익표 ", , 2016-12-31, 528 ,25000,25000,750
154,"IT CookBook, 비주얼 베이직 2015 for Beginner", 임관철 , , 2016-12-30, 432 ,24000,24000,720
155,"IT CookBook, 네트워크 해킹과 보안 개정3판 : 정보 보안 개론과 실습", 양대일 , , 2016-12-28, 584 ,26000,26000,780
156,"IT CookBook, 쉽게 배우는 데이터 통신과 컴퓨터 네트워크 (개정판)", 박기현 , , 2016-12-26, 584 ,27000,27000,810
157,"IT CookBook, 자바스크립트 프로그래밍 입문", 윤인성 , , 2016-12-15, 424 ,25000,25000,750
158,"IT CookBook, 처음 만나는 자동제어공학", 김성중 , , 2016-12-12, 256 ,18000,18000,540
159,"IT CookBook, HTML & CSS for Beginner", 황재호 , , 2016-11-10, 472 ,23000,23000,690
160,"IT CookBook, 처음 만나는 전기기기"," 최은혁 , 박숭규 ", , 2016-11-01, 268 ,20000,20000,600
161,"SWedu, 컴퓨팅 사고력을 키우는 SW 교육 : 엔트리 & 햄스터"," 황준 , 박광현 , 이웅재 , 최은정 , 고혜영 , 이재호 , 손예진 , 조민주 ", , 2016-09-05, 252 ,20000,20000,600
162,ITQ 엑셀 2010," 장수진, 유우종, 임관철 , 김경희 ", , 2016-09-01, 244 ,15000,15000,450
163,ITQ 파워포인트 2010," 장수진, 유우종, 임관철 , 김경희 ", , 2016-09-01, 252 ,15000,15000,450
164,ITQ 한글 2010," 장수진, 유우종, 임관철 , 김경희 ", , 2016-09-01, 252 ,15000,15000,450
165,"IT CookBook, 인터넷 윤리"," 최희식 , 김상균 ", , 2016-08-26, 400 ,22000,22000,660
166,한 권으로 합격하는 MOS 2010 엑셀과 파워포인트," 김경희 , 오해강 ", , 2016-08-26, 220 ,15000,15000,450
167,파이썬으로 배우는 프로그래밍 기초, 크리스 로피 ," 유형목 , 이지호 ", 2016-08-18, 228 ,13000,13000,390
168,"IT CookBook, 자바 프로그래밍 바이블"," 오경주 , 염기호 , 정용훈 ", , 2016-08-12, 948 ,29000,29000,870
169,제대로 알고 쓰는 R 통계분석, 이윤환 , , 2016-08-05, 400 ,25000,25000,750
170,"IT CookBook, C로 배우는 쉬운 자료구조(개정3판)", 이지영 , , 2016-07-28, 596 ,27000,27000,810
171,"IT CookBook, 처음 만나는 디지털 논리회로"," 임석구 , 홍경호 ", , 2016-07-25, 448 ,22000,22000,660
172,"SWedu, 컴퓨팅 사고력을 키우는 SW 교육 : 파이썬", 우재남 , , 2016-07-20, 444 ,22000,22000,660
173,"IT CookBook, 기초 신호 및 시스템", 이철희 , , 2016-07-18, 492 ,26000,26000,780
174,생생한 사례로 배우는 확률과 통계, 이재원 , , 2016-07-15, 476 ,25000,25000,750
175,공학과 경영, 김상균 , , 2016-07-07, 404 ,26000,26000,780
176,"IT CookBook, 운영체제(개정3판)", 구현회 , , 2016-06-30, 684 ,27000,27000,810
177,"IT CookBook, 처음 만나는 전자기학", 곽동주 , , 2016-06-28, 412 ,23000,23000,690
178,"IT CookBook, 디지털 콘텐츠 기획", 김성은 , , 2016-06-27, 508 ,26000,26000,780
179,IT 해외 취업 가이드 : 미국편, 송기봉 , , 2016-06-11, 296 ,18000,18000,540
180,"IT CookBook, 기초전자실험(개정판) : with PSpice", 홍순관 , , 2016-06-10, 296 ,17000,17000,510
181,"IT CookBook, 따라 하면서 배우는 아두이노", 허경용 , , 2016-06-10, 456 ,26000,26000,780
182,제대로 시작하는 기초 통계학 : Excel 활용, 노경섭 , , 2016-06-10, 312 ,24000,24000,720
183,"IT CookBook, 윈도우 서버 2012 R2 : 설치, 운영, 관리+실무 팁"," 남훈식 , 최영락 ", , 2016-02-25, 664 ,28000,28000,840
184,스크래치를 활용한 문제해결능력 향상, 김종훈 , , 2016-02-19, 124 ,9000,9000,270
185,대학생을 위한 스크래치 프로그래밍 : 누구나 할 수 있는 가장 쉬운 프로그래밍 입문서, 김종훈 , , 2016-01-26, 232 ,18000,18000,540
186,미적분학," Carol Ash , Robert B. Ash "," 김광수 , 최형규 ", 2016-01-21, 716 ,35000,35000,1050
187,"IT CookBook, 처음 만나는 전력공학"," 박숭규 , 최은혁 , 최병숙 ", , 2016-01-15, 416 ,23000,23000,690
188,"IT CookBook, 처음 만나는 회로이론", 방성완 , , 2016-01-12, 384 ,20000,20000,600
189,최신 공학수학 with Sage Ⅰ," 이상구 , 김영록 , 박준현 , 김응기 , 이재화 ", , 2016-01-12, 500 ,25000,25000,750
190,최신 공학수학 with Sage Ⅱ," 이상구 , 김영록 , 박준현 , 김응기 , 이재화 ", , 2016-01-12, 444 ,23000,23000,690
191,창의적 공학설계(개정판), 김은경 , , 2016-01-08, 404 ,22000,22000,660
192,"IT CookBook, 최신 이동통신 입문 : Mobile Communications", Jochen H. Schiller ," 곽경섭 , 고영채 ", 2016-01-04, 464 ,28000,28000,840
193,"IT CookBook, 쉬운 영어로 읽는 최신 전산 영어(개정3판)", 조준모 , , 2015-12-30, 300 ,17000,17000,510
194,"IT CookBook, 데이터베이스 기초와 실습 : 액세스 2013", 김지연 , , 2015-12-28, 504 ,25000,25000,750
195,"IT CookBook, 전자상거래와 e-비즈니스(개정3판)", 이동훈 , , 2015-12-28, 512 ,25000,25000,750
196,"IT CookBook, 컴퓨터 사이언스(개정판) : 새내기를 위한 최신 컴퓨터 개론"," 이동명 , 권오현 , 고정국 ", , 2015-12-28, 492 ,24000,24000,720
197,"IT CookBook, 핵심이 보이는 반도체 공학", 권기영 , , 2015-12-18, 568 ,28000,28000,840
198,"IT CookBook, 원리로 이해하는 전력전자공학 : 기초부터 응용까지"," 원충연 , 김영렬 , 이택기 , 정용채 , 이병국 ", , 2015-12-10, 484 ,26000,26000,780
199,"IT CookBook, C# 프로그래밍 : 프로그래밍 기초부터 객체 지향 핵심까지", 윤인성 , , 2015-12-01, 560 ,25000,25000,750
200,"IT CookBook, 쉽게 배우는 소프트웨어 공학", 김치수 , , 2015-12-01, 512 ,25000,25000,750
201,"IT CookBook, 시스템 분석과 설계(개정판) : 효과적인 비즈니스 정보시스템 개발", 허원실 , , 2015-12-01, 408 ,25000,25000,750
202,"IT CookBook, JUST JAVA : 객체지향에 충실한 자바다운 자바", 황희정 , , 2015-10-26, 512 ,25000,25000,750
203,"IT CookBook, UI/UX 디자인 이론과 실습", 이영주 , , 2015-09-23, 506 ,27000,27000,810
204,"IT CookBook, 정보보안 이론과 실제", 마크 스탬프 ," 안태남 , 손용락 , 이광석 ", 2015-09-17, 496 ,25000,25000,750
205,"IT CookBook, 리눅스 프로그래밍 기초 : 시스템 호출, 라이브러리 함수별 실습"," 최태영 , 황준하 , 고재필 , 윤현주 , 김용호 ", , 2015-08-17, 372 ,20000,20000,600
206,앱 인벤터 2 : 구글과 MIT 앱 인벤터 개발팀이 안내하는 안드로이드 프로그래밍," David Wolber , Hal Abelson , Ellen Spertus , Liz Looney "," 오일석 , 이진선 ", 2015-07-20, 384 ,24000,24000,720
207,easy LTE : 초보 기술자를 위한 이동통신 가이드북, 이상근 , , 2015-07-10, 232 ,23000,23000,690
208,"IT CookBook, 원리로 이해하는 마이크로파 공학", 홍익표 , , 2015-07-10, 432 ,26000,26000,780
209,"창의와 혁신의 시크릿, 트리즈 : Training How To Think Inventively", 김은경 , , 2015-07-10, 320 ,23000,23000,690
210,"IT CookBook, 디지털 논리회로(개정3판) : 이론, 실습, 시뮬레이션"," 임석구 , 홍경호 ", , 2015-07-07, 786 ,27000,27000,810
211,"IT CookBook, 핵심 API로 배우는 윈도우 프로그래밍", 강경우 , , 2015-06-28, 464 ,26000,26000,780
212,MATLAB으로 배우는 선형대수학 : Linear Algebra with MATLAB," 이광연 , 설한국 ", , 2015-06-10, 540 ,27000,27000,810
213,창의융합 프로젝트 아이디어북 : Creative Convergence Capstone Design with PBL, 조준동 , , 2015-06-10, 256 ,24000,24000,720
214,"IT CookBook, XML 프로그래밍 : 체계적으로 배우는 XML 원리와 응용", 홍성용 , , 2015-06-08, 672 ,27000,27000,810
215,전공이 보이는 미분적분학: FOR ELECTRICAL & ELECTRONIC ENGINEERS, 장윤석 , , 2015-05-30, 312 ,22000,22000,660
216,"IT CookBook, Play 포토샵", 원다예 , , 2015-04-27, 410 ,22000,22000,660
217,"IT CookBook, 엑셀과 파워포인트 2013 개정판", 강동진 외 4 , , 2015-04-10, 556 ,22000,22000,660
218,"IT CookBook, 비주얼 베이직 2010 for Beginner", 임관철 , , 2015-02-26, 432 ,24000,24000,720
219,"IT CookBook, C C++로 배우는 자료구조론", 주우석 , , 2015-02-24, 696 ,23000,23000,690
220,"IT CookBook, 광통신 공학 : MATLAB과 함께하는 광통신 시스템", 이종형 , , 2015-02-24, 480 ,28000,28000,840
221,"IT CookBook, 디지털 영상처리 입문 : 오감을 자극하는 3차원 입체 학습"," 신종홍 , 장선봉 , 지인호 ", , 2015-02-16, 600 ,25000,25000,750
222,"IT CookBook, 엑셀 2013 : 기본 기능부터 실무 활용까지", 하숙정 , , 2015-02-16, 520 ,20000,20000,600
